parents,husband,wife,husband_id,wife_id,n_sons,sons,n_daughters,daughters,n_unknown_sex,epic,source,comments,row_type,historicity,family_id
King of Kalinga,King of Kalinga,,mahavamsa::king_of_kalinga,,1,Prince,1,Princess,0,mahavamsa,Mahavamsa Ch.6,Prince lineage leads to Royal Standard Bearer,couple,legendary,
King of Vanga and Princess of Kalinga,King of Vanga,Princess of Kalinga,mahavamsa::king_of_vanga,mahavamsa::princess_of_kalinga,0,,1,Suppadevi,0,mahavamsa,Mahavamsa Ch.6,,couple,legendary,
The Lion and Suppadevi,The Lion,Suppadevi,mahavamsa::the_lion,mahavamsa::suppadevi,1,Sihabahu,1,Sihasivali,0,mahavamsa,Mahavamsa Ch.6,Suppadevi also later married Royal Standard Bearer,couple,legendary,
Royal Standard Bearer and Suppadevi,Royal Standard Bearer,Suppadevi,mahavamsa::royal_standard_bearer,mahavamsa::suppadevi,0,,0,,0,mahavamsa,Mahavamsa Ch.6,Prince of Kalinga; second husband of Suppadevi; no children shown in tree,couple,legendary,
Sihabahu and Sihasivali,Sihabahu,Sihasivali,mahavamsa::sihabahu,mahavamsa::sihasivali,3,"Vijaya I, Vijaya of Pandava, Sumitta",0,,0,mahavamsa,Mahavamsa Ch.6-7,had 32 sons per Mahavamsa text; Vijaya of Pandava became King of Madhura; other issue noted,couple,legendary,
Vijaya I and Kuveni,Vijaya I,Kuveni,mahavamsa::vijaya_i,mahavamsa::kuveni,1,Jivatissa,1,Dissala,0,mahavamsa,Mahavamsa Ch.7,first king of Lanka 543-505 BC; Kuveni was a yaksha princess,couple,semi-historical,
Jivatissa and Dissala,Jivatissa,Dissala,mahavamsa::jivatissa,mahavamsa::dissala,0,,0,,0,mahavamsa,Mahavamsa Ch.7,children of Vijaya by Kuveni; fled to Sumanakuta; descendants not traced,couple,legendary,
Sumitta and Princess of Madha,Sumitta,Princess of Madha,mahavamsa::sumitta,mahavamsa::princess_of_madha,0,,0,,0,mahavamsa,Mahavamsa Ch.8,issue mentioned but not named,couple,legendary,
Jayasena,Jayasena,,mahavamsa::jayasena,,0,,0,,0,mahavamsa,Mahavamsa Ch.2,King of Kapilavatthu; Mahasammata line of Kings; ancestor of both Kapilavatthu and Devadaha branches,couple,legendary,
Sihahanu and Kacchana,Sihahanu,Kacchana,mahavamsa::sihahanu,mahavamsa::kacchana,7,"Amitodana, Ghatitidana, Dhotodana, Sukkodana, Pamita, Suddhodana, Dandapani",0,,0,mahavamsa,Mahavamsa Ch.2,Kapilavatthu branch under Jayasena; Ghatitidana may be variant of Sakkodana; tree also notes Kacchana (married Sihahanu) separately,couple,legendary,
Dhotodana and Maya,Dhotodana,Maya,mahavamsa::dhotodana,mahavamsa::maya_wife_of_dhotodana,0,,0,,0,mahavamsa,Mahavamsa Ch.2,Dhotodana was son of Sihahanu; Maya shown with = sign in tree; possibly different Maya from wife of Suddhodana; no children shown,couple,legendary,
Anjana and Yasodhara,Anjana,Yasodhara,mahavamsa::anjana,mahavamsa::yasodhara,1,Suppbuddha,2,"Maya, Pajapati",0,mahavamsa,Mahavamsa Ch.2,Devadaha branch; Maya and Pajapati both married Suddhodana; Kacchana (married Sihahanu) also shown as related,couple,legendary,
Suddhodana and Maya,Suddhodana,Maya,mahavamsa::suddhodana,mahavamsa::maya,1,Siddhartha,0,,0,mahavamsa,Mahavamsa Ch.2,Suddhodana also married Pajapati (Maha Pajapati Gotami); Siddhartha is the Buddha,couple,legendary,
Suddhodana and Pajapati,Suddhodana,Pajapati,mahavamsa::suddhodana,mahavamsa::pajapati,0,,0,,0,mahavamsa,Mahavamsa Ch.2,Pajapati (Maha Pajapati Gotami) was second wife of Suddhodana; from Devadaha; no separate children shown in tree,couple,legendary,
Siddhartha and Subhaddakacchana,Siddhartha,Subhaddakacchana,mahavamsa::siddhartha,mahavamsa::subhaddakacchana,1,Rahula,0,,0,mahavamsa,Mahavamsa Ch.2,Siddhartha is the Buddha,couple,legendary,
Suppbuddha,Suppbuddha,,mahavamsa::suppbuddha,,1,Devadatta,1,Subhaddakacchana,0,mahavamsa,Mahavamsa Ch.2,Subhaddakacchana married Siddhartha,couple,legendary,
Amitodana,Amitodana,,mahavamsa::amitodana,,1,Pandu,0,,0,mahavamsa,Mahavamsa Ch.8,son of Sihahanu; father/ancestor of Pandu,couple,legendary,
Pandu and Susima,Pandu,Susima,mahavamsa::pandu,mahavamsa::susima,8,"Panduvasudeva, Dighaya, Rama, Uruvela, Anuradha, Vigita, Rohana, Gamani",0,,0,mahavamsa,Mahavamsa Ch.8,Pandu is descendant of Amitodana; all sons listed in tree,couple,legendary,
Panduvasudeva and Bhaddakacchana,Panduvasudeva,Bhaddakacchana,mahavamsa::panduvasudeva,mahavamsa::bhaddakacchana,2,"Abhaya Tissa I, Girikandasiva",1,Citta,0,mahavamsa,Mahavamsa Ch.8-9,King of Lanka 504-474 BC; Bhaddakacchana was Sakyan princess; other issue also noted,couple,semi-historical,
Dighagamani and Citta,Dighagamani,Citta,mahavamsa::dighagamani,mahavamsa::citta,0,,1,Suvannapali,0,mahavamsa,Mahavamsa Ch.9,,couple,semi-historical,
Pandukabhaya and Suvannapali,Pandukabhaya,Suvannapali,mahavamsa::pandukabhaya,mahavamsa::suvannapali,1,Mutasiva,0,,0,mahavamsa,Mahavamsa Ch.9-10,King of Lanka 437-367 BC,couple,semi-historical,
Mutasiva,Mutasiva,,mahavamsa::mutasiva,,9,"Devanampiya Tissa, Uttiya, Mahanaga, Mahasiva, Suratissa, Asela, Mattabhaya, Asoka, Uddhachulabhaya",0,,0,mahavamsa,Mahavamsa Ch.11,King of Lanka 367-307 BC; had 10 sons and 2 daughters per text but tree shows 9 named sons,couple,semi-historical,
Devanampiya Tissa,Devanampiya Tissa,,mahavamsa::devanampiya_tissa,,1,Son,0,,0,mahavamsa,Mahavamsa Ch.11-20,King of Lanka 307-267 BC; son died in childhood; introduced Buddhism,couple,historical,
Uttiya,Uttiya,,mahavamsa::uttiya,,0,,0,,0,mahavamsa,Mahavamsa Ch.20,King of Lanka 267-257 BC; tree shows (issue) with Uttiya and Tissa below,couple,historical,
Uttiya (issue),,,,,2,"Uttiya, Tissa",0,,0,mahavamsa,Mahavamsa Ch.22,descendants of Uttiya son of Mutasiva; Tissa connects to Vihara Devi,couple,semi-historical,
Mahanaga and Anula,Mahanaga,Anula,mahavamsa::mahanaga_ruhuna,mahavamsa::anula_wife_of_mahanaga,1,Gothabhaya,0,,0,mahavamsa,Mahavamsa Ch.22,Mahanaga was son of Mutasiva; founded Ruhuna kingdom,couple,semi-historical,
Gothabhaya,Gothabhaya,,mahavamsa::gothabhaya_ruhuna,,0,,0,,0,mahavamsa,Mahavamsa Ch.22,ancestor of Kakavanna Tissa; Ruhuna line,couple,semi-historical,
Kakavanna Tissa and Vihara Devi,Kakavanna Tissa,Vihara Devi,mahavamsa::kakavanna_tissa,mahavamsa::vihara_devi,2,"Duttha Gamani, Saddha Tissa",0,,0,mahavamsa,Mahavamsa Ch.22-23,King of Ruhuna; Vihara Devi came by sea,couple,semi-historical,
Kakavanna Tissa and Second Wife,Kakavanna Tissa,Second Wife,mahavamsa::kakavanna_tissa,mahavamsa::second_wife_of_kakavanna,1,Dighabhaya,0,,0,mahavamsa,Mahavamsa Ch.22,second wife of Kakavanna Tissa,couple,semi-historical,
Duttha Gamani,Duttha Gamani,,mahavamsa::duttha_gamani,,1,Sali,0,,0,mahavamsa,Mahavamsa Ch.24-32,King of Lanka 161-137 BC; defeated Elara,couple,historical,
Sali and Asokamala,Sali,Asokamala,mahavamsa::sali,mahavamsa::asokamala,0,,0,,0,mahavamsa,Mahavamsa Ch.32,renounced throne for love of Asokamala,couple,semi-historical,
Saddha Tissa and Anula,Saddha Tissa,Anula,mahavamsa::saddha_tissa,mahavamsa::anula_wife_of_saddha_tissa,4,"Thullatthanaka, Lajatissa, Khallatanaga, Vatta Gamani",1,Somadevi,0,mahavamsa,Mahavamsa Ch.33,King of Lanka 137-119 BC,couple,historical,
Vatta Gamani and Somadevi,Vatta Gamani,Somadevi,mahavamsa::vatta_gamani,mahavamsa::somadevi,0,,0,,0,mahavamsa,Mahavamsa Ch.33-34,King of Lanka 103 BC and 89-76 BC; no children shown by Somadevi in tree,couple,historical,
Vatta Gamani and Anula,Vatta Gamani,Anula,mahavamsa::vatta_gamani,mahavamsa::anula_wife_of_vatta_gamani,1,Mahanaga,0,,0,mahavamsa,Mahavamsa Ch.33-34,second wife; Mahanaga also called Cora,couple,historical,
Khallatanaga,Khallatanaga,,mahavamsa::khallatanaga,,1,Mahacula Mahatissa,0,,0,mahavamsa,Mahavamsa Ch.33,King of Lanka 109-103 BC,couple,historical,
Mahacula Mahatissa and Anula,Mahacula Mahatissa,Anula,mahavamsa::mahacula_mahatissa,mahavamsa::anula_wife_of_mahacula,2,"Kalkanni Tissa, Tissa IV",0,,0,mahavamsa,Mahavamsa Ch.33,King of Lanka 76-62 BC; Anula later married Cora (Mahanaga),couple,historical,
Cora and Anula,Cora,Anula,mahavamsa::cora,mahavamsa::anula_wife_of_mahacula,0,,0,,0,mahavamsa,Mahavamsa Ch.33,also called Mahanaga; King of Lanka 62-50 BC; son of Vatta Gamani; married Anula previously wife of Mahacula Mahatissa,couple,historical,
Kalkanni Tissa,Kalkanni Tissa,,mahavamsa::kalkanni_tissa,,1,Bhatikabhaya,0,,0,mahavamsa,Mahavamsa Ch.33,King of Lanka 44-22 BC,couple,historical,
Mahadathia Mahanaga,Mahadathia Mahanaga,,mahavamsa::mahadathia_mahanaga,,2,"Amanda Gamani, Kanijanu Tissa",0,,0,mahavamsa,Mahavamsa Ch.33,King 7-19 AD; brother of Bhatikabhaya,couple,historical,
Amanda Gamani,Amanda Gamani,,mahavamsa::amanda_gamani,,1,Culabhaya,1,Sivali,0,mahavamsa,Mahavamsa Ch.33,King 19-29 AD; Sivali was queen regnant,couple,historical,
Kanijanu Tissa,Kanijanu Tissa,,mahavamsa::kanijanu_tissa,,1,Ilanaga,0,,0,mahavamsa,Mahavamsa Ch.35,King 29-32 AD,couple,historical,
Ilanaga and Mahamatta,Ilanaga,Mahamatta,mahavamsa::ilanaga,mahavamsa::mahamatta_wife_of_ilanaga,2,"Candumukha Siva, Yasalalaka Tissa",0,,0,mahavamsa,Mahavamsa Ch.35,King 33-43 AD,couple,historical,
,Sena I and Guttika,,,,0,,0,,0,mahavamsa,Mahavamsa Ch.21,Tamil usurpers; ruled 237-215 BC; killed Suratissa,usurper,historical,
,Elara,,,,0,,0,,0,mahavamsa,Mahavamsa Ch.21,Chola invader; ruled 205-161 BC; defeated by Duttha Gamani,usurper,historical,
,Pulahattha,,,,0,,0,,0,mahavamsa,Mahavamsa Ch.33,Tamil usurper; ruled 103-100 BC,usurper,historical,
,Bahiya,,,,0,,0,,0,mahavamsa,Mahavamsa Ch.33,Tamil usurper; ruled 100-98 BC,usurper,historical,
,Panayamara,,,,0,,0,,0,mahavamsa,Mahavamsa Ch.33,Tamil usurper; ruled 98-91 BC,usurper,historical,
,Pilayamara,,,,0,,0,,0,mahavamsa,Mahavamsa Ch.33,Tamil usurper; ruled 91-90 BC,usurper,historical,
,Dathiya I,,,,0,,0,,0,mahavamsa,Mahavamsa Ch.33,Tamil usurper; ruled 90-89 BC,usurper,historical,
,Subha,,mahavamsa::subha,,0,,0,,0,mahavamsa,Mahavamsa Ch.35,hall porter who killed Yasalalaka Tissa; King 60-67 AD,couple,historical,
Vasabha and Metta,Vasabha,Metta,mahavamsa::vasabha,mahavamsa::metta,1,Vankanasika Tissa,0,,0,mahavamsa,Mahavamsa Ch.35,Lambakanna race; King 67-111 AD,couple,historical,
Vankanasika Tissa and Mahamatta,Vankanasika Tissa,Mahamatta,mahavamsa::vankanasika_tissa,mahavamsa::mahamatta_wife_of_vankanasika,0,,0,,0,mahavamsa,Mahavamsa Ch.35,King 111-114 AD; son of Vasabha,couple,historical,
Mahallaka Naga,Mahallaka Naga,,mahavamsa::mahallaka_naga,,2,"Kanittha Tissa, Bhatika Tissa",1,Queen,0,mahavamsa,Mahavamsa Ch.35,King 136-143 AD; unnamed daughter married Gajabahu I,couple,historical,
Gajabahu I and Queen,Gajabahu I,Queen,mahavamsa::gajabahu_i,mahavamsa::queen_daughter_of_mahallaka_naga,0,,0,,0,mahavamsa,Mahavamsa Ch.35,King 114-136 AD; Queen was daughter of Mahallaka Naga,couple,historical,
Kanittha Tissa,Kanittha Tissa,,mahavamsa::kanittha_tissa,,2,"Culanaga, Kuddanaga",0,,0,mahavamsa,Mahavamsa Ch.35-36,King 167-186 AD,couple,historical,
Kuddanaga and Queen,Kuddanaga,Queen,mahavamsa::kuddanaga,mahavamsa::queen_wife_of_kuddanaga,1,Sirinaga I,0,,0,mahavamsa,Mahavamsa Ch.36,King 187-189 AD,couple,historical,
Subhadeva,Subhadeva,,mahavamsa::subhadeva,,0,,1,Queen,0,mahavamsa,Mahavamsa Ch.36,daughter married Voharika Tissa,couple,historical,
Sirinaga I,Sirinaga I,,mahavamsa::sirinaga_i,,2,"Abhayanaga, Voharika Tissa",0,,0,mahavamsa,Mahavamsa Ch.36,King 189-209 AD,couple,historical,
Voharika Tissa and Queen,Voharika Tissa,Queen,mahavamsa::voharika_tissa,mahavamsa::queen_daughter_of_subhadeva,1,Sirinaga II,0,,0,mahavamsa,Mahavamsa Ch.36,King 209-231 AD; Queen was daughter of Subhadeva,couple,historical,
Sirinaga II,Sirinaga II,,mahavamsa::sirinaga_ii,,1,Vijaya II,0,,0,mahavamsa,Mahavamsa Ch.36,King 240-242 AD,couple,historical,
Vijaya II,Vijaya II,,mahavamsa::vijaya_ii,,0,,0,,0,mahavamsa,Mahavamsa Ch.36,King 242-243 AD; killed by Sanghatissa I,couple,historical,
,Sanghatissa I,,mahavamsa::sanghatissa_i,,0,,0,,0,mahavamsa,Mahavamsa Ch.36,Lambakanna; killed Vijaya II; King 243-247 AD,couple,historical,
,Siri Sangha Bodhi I,,mahavamsa::siri_sangha_bodhi_i,,0,,0,,0,mahavamsa,Mahavamsa Ch.36,Lambakanna race; King 247-249 AD,couple,historical,
Gothabhaya (Lambakanna),Gothabhaya,,mahavamsa::gothabhaya_lambakanna,,2,"Jettha Tissa I, Mahasena",0,,0,mahavamsa,Mahavamsa Ch.36-37,Lambakanna race; King 249-262 AD; different from Gothabhaya of Ruhuna in Tree I,couple,historical,
